{
  "blocked_actions": [
    "autonomous_emergency_dispatch",
    "medical_diagnosis"
  ],
  "completion_status": "complete",
  "counts": {
    "agent_handoffs": 1,
    "journal_entries": 1,
    "observations": 1,
    "reviews": 1
  },
  "created_at": "2026-05-21T17:41:12.599170Z",
  "derived_outputs": {
    "alert_draft_has_provenance": true,
    "dashboard_includes_event": true
  },
  "event": {
    "camera_id": "living_room",
    "confidence": "high",
    "event_type": "possible_floor_stay",
    "occurred_at": "2026-05-20T02:36:31.832047Z",
    "severity": "high",
    "status": "human_confirmed",
    "zone_id": "floor_zone"
  },
  "event_id": "evt_d9aa38bdc636459c92ea4e25f665cd0d",
  "human_review": {
    "decision": "human_confirmed",
    "reviewed_at": "2026-05-20T02:38:02.406241Z",
    "reviewer": "Steven"
  },
  "receipt_id": "receipt_evt_d9aa38bdc636459c92ea4e25f665cd0d",
  "safety_boundaries": [
    "raw_video_local",
    "human_review_required",
    "sqlite_canonical",
    "dashboard_derived",
    "read_only_receipt",
    "no_autonomous_dispatch",
    "no_medical_diagnosis"
  ],
  "schema": "blackbox-receipt",
  "source_of_truth": "sqlite",
  "track_ids": [
    "track_5"
  ]
}
