{
  "schema": "blackbox-receipt",
  "receipt_id": "receipt_evt_d9aa38bdc636459c92ea4e25f665cd0d",
  "event_id": "evt_d9aa38bdc636459c92ea4e25f665cd0d",
  "created_at": "2026-05-20T02:40:00Z",
  "source_of_truth": "sqlite",
  "completion_status": "complete",
  "event": {
    "event_type": "possible_floor_stay",
    "status": "human_confirmed",
    "occurred_at": "2026-05-20T02:36:31Z",
    "camera_id": "living_room",
    "zone_id": "floor_zone",
    "severity": "high",
    "confidence": "high"
  },
  "counts": {
    "observations": 1,
    "reviews": 1,
    "journal_entries": 1,
    "agent_handoffs": 1
  },
  "track_ids": ["track_5"],
  "human_review": {
    "reviewer": "Steven",
    "decision": "human_confirmed",
    "reviewed_at": "2026-05-20T02:38:02Z"
  },
  "derived_outputs": {
    "dashboard_includes_event": true,
    "alert_draft_has_provenance": true
  },
  "blocked_actions": ["autonomous_emergency_dispatch", "medical_diagnosis"],
  "safety_boundaries": [
    "raw_video_local",
    "human_review_required",
    "sqlite_canonical",
    "dashboard_derived",
    "read_only_receipt",
    "no_autonomous_dispatch",
    "no_medical_diagnosis"
  ]
}
